{
  "$id": "citable://schemas/corroboration-import.schema.json",
  "$schema": "http://json-schema.org/draft-07/schema#",
  "title": "External corroboration import",
  "type": "object",
  "additionalProperties": false,
  "required": ["schema_version", "provider", "dataset", "collected_at", "collection_authority", "authenticity_status", "representativeness", "coverage", "mentions"],
  "properties": {
    "schema_version": { "const": 1 },
    "provider": { "type": "string", "minLength": 1 },
    "dataset": { "const": "external_mentions" },
    "collected_at": { "type": "string", "format": "date-time" },
    "collection_authority": { "type": "string", "enum": ["owner_export", "third_party_export", "manual_entry"] },
    "authenticity_status": { "type": "string", "enum": ["cryptographically_authenticated", "provider_range_verified", "owner_attested", "transport_authenticated", "checksum_protected_only", "unverified"] },
    "representativeness": { "type": "string", "enum": ["production_population", "complete_export", "statistically_sampled", "convenience_sample", "single_observation", "unknown"] },
    "coverage": {
      "type": "object",
      "additionalProperties": false,
      "required": ["population", "sampled", "exclusions"],
      "properties": {
        "population": { "type": "string", "minLength": 1 },
        "sampled": { "type": "integer", "minimum": 1 },
        "exclusions": { "type": "array", "items": { "type": "string", "minLength": 1 } }
      }
    },
    "mentions": {
      "type": "array",
      "minItems": 1,
      "items": {
        "type": "object",
        "additionalProperties": false,
        "required": ["source_url", "publisher", "entity", "source_control", "relationship_disclosure", "source_type", "observed_at"],
        "properties": {
          "source_url": { "type": "string", "format": "uri", "pattern": "^https://" },
          "canonical_url": { "type": "string", "format": "uri", "pattern": "^https://" },
          "publisher": { "type": "string", "minLength": 1 },
          "entity": { "type": "string", "minLength": 1 },
          "source_control": { "type": "string", "enum": ["independent", "owner_controlled", "affiliated", "unknown"] },
          "relationship_disclosure": { "type": "string", "enum": ["none_disclosed", "affiliated", "sponsored", "unknown"] },
          "source_type": { "type": "string", "enum": ["editorial", "standards", "academic", "review", "directory", "social", "forum", "backlink", "other"] },
          "observed_at": { "type": "string", "format": "date-time" },
          "context_excerpt": { "type": "string" },
          "claim_ids": { "type": "array", "items": { "type": "string", "minLength": 1 }, "uniqueItems": true }
        }
      }
    }
  }
}
